{
  "year" : 2011,
  "senateBillNo" : "A1928-2011",
  "billEvents" : [ {
    "eventDate" : 1294808400000,
    "eventText" : "referred to agriculture",
    "billEventId" : "A1928-2011-1294808400000-referred+to+agriculture",
    "sobiReferenceList" : [ ],
    "luceneActive" : true,
    "luceneModified" : 0
  } ],
  "votes" : null,
  "sponsor" : {
    "id" : null,
    "position" : null,
    "fullname" : "Rosenthal",
    "branch" : null,
    "contactInfo" : null,
    "guid" : null
  },
  "title" : "Confinement of animals for food producing purposes",
  "summary" : "Pertains to confinement of animals for food producing purposes; prohibits any person to tether or confine any pig during pregnancy, calf raised for veal, or egg-laying hen who is kept on a farm for all or the majority of any day in a manner that prevents such animal from lying down, standing up and fully extending its limbs and turning around freely; establishes that commission of such crime shall constitute a class A misdemeanor punishable by imprisonment for a period not to exceed one year and/or fine not to exceed $1,000. ",
  "currentCommittee" : null,
  "sameAs" : null,
  "lawSection" : "Agriculture and Markets Law",
  "previousVersions" : [ "A8163-2009" ],
  "coSponsors" : [ {
    "id" : null,
    "position" : null,
    "fullname" : "Castro",
    "branch" : null,
    "contactInfo" : null,
    "guid" : null
  }, {
    "id" : null,
    "position" : null,
    "fullname" : "Paulin",
    "branch" : null,
    "contactInfo" : null,
    "guid" : null
  }, {
    "id" : null,
    "position" : null,
    "fullname" : "Maisel",
    "branch" : null,
    "contactInfo" : null,
    "guid" : null
  }, {
    "id" : null,
    "position" : null,
    "fullname" : "McEneny",
    "branch" : null,
    "contactInfo" : null,
    "guid" : null
  }, {
    "id" : null,
    "position" : null,
    "fullname" : "Kellner",
    "branch" : null,
    "contactInfo" : null,
    "guid" : null
  }, {
    "id" : null,
    "position" : null,
    "fullname" : "Kavanagh",
    "branch" : null,
    "contactInfo" : null,
    "guid" : null
  }, {
    "id" : null,
    "position" : null,
    "fullname" : "Millman",
    "branch" : null,
    "contactInfo" : null,
    "guid" : null
  }, {
    "id" : null,
    "position" : null,
    "fullname" : "Robinson",
    "branch" : null,
    "contactInfo" : null,
    "guid" : null
  }, {
    "id" : null,
    "position" : null,
    "fullname" : "Gottfried",
    "branch" : null,
    "contactInfo" : null,
    "guid" : null
  }, {
    "id" : null,
    "position" : null,
    "fullname" : "Englebright",
    "branch" : null,
    "contactInfo" : null,
    "guid" : null
  } ],
  "pastCommittees" : null,
  "fulltext" : "\n                           S T A T E   O F   N E W   Y O R K\n       ________________________________________________________________________\n\n                                         1928\n\n                              2011-2012 Regular Sessions\n\n                                 I N  A S S E M B L Y\n\n                                   January 12, 2011\n                                      ___________\n\n       Introduced by M. of A. ROSENTHAL, CASTRO, PAULIN, MAISEL, McENENY, KELL-\n         NER,  KAVANAGH,  MILLMAN,  ROBINSON,  GOTTFRIED, ENGLEBRIGHT -- Multi-\n         Sponsored by -- M. of  A.    BING,  CUSICK,  GLICK,  HEVESI,  LATIMER,\n         V. LOPEZ, TITUS, WEISENBERG -- read once and referred to the Committee\n         on Agriculture\n\n       AN  ACT  to  amend  the  agriculture and markets law, in relation to the\n         confinement of animals for food producing purposes\n\n         THE PEOPLE OF THE STATE OF NEW YORK, REPRESENTED IN SENATE AND  ASSEM-\n       BLY, DO ENACT AS FOLLOWS:\n\n    1    Section  1. The agriculture and markets law is amended by adding a new\n    2  section 353-e to read as follows:\n    3    S 353-E. CONFINEMENT OF ANIMALS FOR FOOD PRODUCING PURPOSES. 1.    FOR\n    4  PURPOSES  OF  THIS SECTION, THE FOLLOWING TERMS SHALL HAVE THE FOLLOWING\n    5  MEANINGS:\n    6    (A) \"CALF RAISED FOR VEAL\" MEANS ANY CALF OF THE BOVINE  SPECIES  KEPT\n    7  FOR THE PURPOSE OF PRODUCING THE FOOD PRODUCT DESCRIBED AS VEAL.\n    8    (B)  \"COVERED ANIMALS\" MEANS ANY PIG DURING PREGNANCY, CALF RAISED FOR\n    9  VEAL, OR EGG-LAYING HEN WHO IS KEPT ON A FARM.\n   10    (C) \"EGG-LAYING HEN\" MEANS ANY FEMALE  DOMESTICATED  CHICKEN,  TURKEY,\n   11  DUCK, GOOSE, OR GUINEA FOWL KEPT FOR THE PURPOSE OF EGG PRODUCTION.\n   12    (D)  \"ENCLOSURE\"  MEANS ANY CAGE, CRATE, OR OTHER STRUCTURE (INCLUDING\n   13  WHAT IS COMMONLY DESCRIBED AS A \"GESTATION  CRATE\"  FOR  PIGS,  A  \"VEAL\n   14  CRATE\"  FOR  CALVES,  OR  A  \"BATTERY CAGE\" FOR EGG-LAYING HENS) USED TO\n   15  CONFINE A COVERED ANIMAL.\n   16    (E) \"FARM\" MEANS THE LAND, BUILDING,  SUPPORT  FACILITIES,  AND  OTHER\n   17  EQUIPMENT   THAT  ARE  WHOLLY  OR  PARTIALLY  USED  FOR  THE  COMMERCIAL\n   18  PRODUCTION OF ANIMALS OR ANIMAL PRODUCTS USED FOR  FOOD  OR  FIBER,  AND\n   19  DOES NOT INCLUDE LIVE ANIMAL MARKETS.\n   20    (F)  \"FULLY EXTENDING ITS LIMBS\" MEANS FULLY EXTENDING ALL LIMBS WITH-\n   21  OUT TOUCHING THE SIDE  OF  AN  ENCLOSURE,  INCLUDING,  IN  THE  CASE  OF\n\n        EXPLANATION--Matter in ITALICS (underscored) is new; matter in brackets\n                             [ ] is old law to be omitted.\n                                                                  LBD01837-01-1\n\n       A. 1928                             2\n\n    1  EGG-LAYING HENS, FULLY SPREADING BOTH WINGS WITHOUT TOUCHING THE SIDE OF\n    2  AN ENCLOSURE OR OTHER EGG-LAYING HENS.\n    3    (G)  \"PERSON\"  MEANS ANY INDIVIDUAL, CORPORATION, PARTNERSHIP, ASSOCI-\n    4  ATION, OR OTHER LEGAL ENTITY.\n    5    (H) \"PIG DURING PREGNANCY\" MEANS  ANY  PREGNANT  PIG  OF  THE  PORCINE\n    6  SPECIES KEPT FOR THE PRIMARY PURPOSE OF BREEDING.\n    7    (I) \"TURNING AROUND FREELY\" MEANS TURNING IN A COMPLETE CIRCLE WITHOUT\n    8  ANY  IMPEDIMENT, INCLUDING A TETHER, AND WITHOUT TOUCHING THE SIDE OF AN\n    9  ENCLOSURE.\n   10    2. IT SHALL BE UNLAWFUL FOR  ANY  PERSON  TO  TETHER  OR  CONFINE  ANY\n   11  COVERED ANIMAL, AS DEFINED IN SUBDIVISION ONE OF THIS SECTION, ON A FARM\n   12  FOR  ALL  OR  THE  MAJORITY  OF  ANY DAY, IN A MANNER THAT PREVENTS SUCH\n   13  ANIMAL FROM LYING DOWN, STANDING UP AND FULLY EXTENDING  ITS  LIMBS  AND\n   14  TURNING AROUND FREELY.\n   15    3.  THIS  SECTION  SHALL  NOT  APPLY  DURING  THE  FOLLOWING  LAWFULLY\n   16  PERFORMED ACTIVITIES:\n   17    (A) TRANSPORTATION,\n   18    (B) EXHIBITIONS AT RODEOS, FAIRS, YOUTH PROGRAMS, AND SIMILAR  EXHIBI-\n   19  TIONS,\n   20    (C) SLAUGHTERING PROCESS,\n   21    (D) SCIENTIFIC OR AGRICULTURAL RESEARCH,\n   22    (E) EXAMINATION, TESTING, INDIVIDUAL TREATMENT OR OPERATION FOR VETER-\n   23  INARY PURPOSES,\n   24    (F)  TO  A PIG DURING THE SEVEN-DAY PERIOD PRIOR TO THE PIG'S EXPECTED\n   25  DATE OF GIVING BIRTH.\n   26    4. A VIOLATION OF THE PROVISIONS OF THIS SECTION IS A CLASS  A  MISDE-\n   27  MEANOR  PUNISHABLE  BY IMPRISONMENT FOR A PERIOD NOT TO EXCEED ONE YEAR,\n   28  OR BY A FINE NOT TO EXCEED ONE THOUSAND DOLLARS, OR BY  BOTH  SUCH  FINE\n   29  AND IMPRISONMENT.\n   30    5.  NOTHING  CONTAINED  IN  THIS SECTION SHALL PREVENT ANY TOWN, CITY,\n   31  VILLAGE OR COUNTY IN NEW YORK STATE FROM ENACTING A LOCAL LAW  OR  ORDI-\n   32  NANCE  TO  PROVIDE FOR THE HUMANE TREATMENT OF AND PREVENTION OF CRUELTY\n   33  TO FARM ANIMALS, PROVIDED, HOWEVER, THAT NO SUCH LAW SHALL CONFLICT WITH\n   34  THE PROVISIONS OF THIS SECTION.\n   35    6. NOTHING CONTAINED IN THIS SECTION SHALL BE CONSTRUED TO REDUCE  THE\n   36  PROTECTION  AFFORDED  TO  FARM  ANIMALS  UNDER ANY OTHER SECTION OF THIS\n   37  ARTICLE OR ANY OTHER LAW OR REGULATION. NOTHING IN THIS SECTION SHALL BE\n   38  CONSTRUED TO LIMIT OR RESTRICT AGENTS OR OFFICERS OF SOCIETIES  FOR  THE\n   39  PREVENTION  OF CRUELTY TO ANIMALS OR THE POLICE FROM ENFORCING THE OTHER\n   40  PROVISIONS OF THIS ARTICLE OR ANY OTHER LAW OR  REGULATION  RELATING  TO\n   41  THE HUMANE TREATMENT OF OR CRUELTY TO ANIMALS.\n   42    7. THIS SECTION SHALL BE ENFORCED BY THE DEPARTMENT, AND ANY AGENT AND\n   43  OFFICER  OF  ANY DULY INCORPORATED SOCIETY FOR THE PREVENTION OF CRUELTY\n   44  TO ANIMALS MAY ISSUE AN APPEARANCE TICKET PURSUANT TO SECTION 150.20  OF\n   45  THE  CRIMINAL PROCEDURE LAW, SUMMONS OR ARREST, AND BRING BEFORE A COURT\n   46  OR MAGISTRATE HAVING JURISDICTION, ANY PERSON OFFENDING AGAINST  ANY  OF\n   47  THE PROVISIONS OF THIS SECTION.\n   48    S 2. This act shall take effect January 1, 2015.\n",
  "memo" : null,
  "law" : null,
  "actClause" : "AN ACT to amend the agriculture and markets law, in relation to the confinement of animals for food producing purposes ",
  "sortIndex" : -1,
  "latestAmendment" : null,
  "sobiReferenceList" : [ "SOBI.D110112.T152028.TXT", "SOBI.D110112.T170529.TXT" ],
  "luceneActive" : true,
  "luceneModified" : 1294869929339
}