{
  "year" : 2011,
  "senateBillNo" : "S1025-2011",
  "billEvents" : [ {
    "eventDate" : 1294203600000,
    "eventText" : "REFERRED TO JUDICIARY",
    "billEventId" : "S1025-2011-1294203600000-REFERRED+TO+JUDICIARY",
    "sobiReferenceList" : [ ],
    "luceneActive" : true,
    "luceneModified" : 0
  } ],
  "votes" : null,
  "sponsor" : {
    "id" : null,
    "position" : null,
    "fullname" : "KLEIN",
    "branch" : null,
    "contactInfo" : null,
    "guid" : null
  },
  "title" : "Extends dram shop liability to cover persons who sell false identification to a person under 21 years of age who causes injury or damages while intoxicated",
  "summary" : "Extends dram shop liability to cover persons who sell false identification to a person under 21 years of age who causes injury or damages while intoxicated or whose ability is impaired. ",
  "currentCommittee" : "JUDICIARY",
  "sameAs" : null,
  "lawSection" : "General Obligations Law",
  "previousVersions" : [ "SA1871-2009", "S1871-2009", "AA1871-2009" ],
  "coSponsors" : [ {
    "id" : null,
    "position" : null,
    "fullname" : "ADAMS",
    "branch" : null,
    "contactInfo" : null,
    "guid" : null
  }, {
    "id" : null,
    "position" : null,
    "fullname" : "ADDABBO",
    "branch" : null,
    "contactInfo" : null,
    "guid" : null
  }, {
    "id" : null,
    "position" : null,
    "fullname" : "BRESLIN",
    "branch" : null,
    "contactInfo" : null,
    "guid" : null
  }, {
    "id" : null,
    "position" : null,
    "fullname" : "DIAZ",
    "branch" : null,
    "contactInfo" : null,
    "guid" : null
  }, {
    "id" : null,
    "position" : null,
    "fullname" : "DILAN",
    "branch" : null,
    "contactInfo" : null,
    "guid" : null
  }, {
    "id" : null,
    "position" : null,
    "fullname" : "HASSELL-THOMPSON",
    "branch" : null,
    "contactInfo" : null,
    "guid" : null
  }, {
    "id" : null,
    "position" : null,
    "fullname" : "HUNTLEY",
    "branch" : null,
    "contactInfo" : null,
    "guid" : null
  }, {
    "id" : null,
    "position" : null,
    "fullname" : "MONTGOMERY",
    "branch" : null,
    "contactInfo" : null,
    "guid" : null
  }, {
    "id" : null,
    "position" : null,
    "fullname" : "OPPENHEIMER",
    "branch" : null,
    "contactInfo" : null,
    "guid" : null
  }, {
    "id" : null,
    "position" : null,
    "fullname" : "PARKER",
    "branch" : null,
    "contactInfo" : null,
    "guid" : null
  }, {
    "id" : null,
    "position" : null,
    "fullname" : "PERKINS",
    "branch" : null,
    "contactInfo" : null,
    "guid" : null
  }, {
    "id" : null,
    "position" : null,
    "fullname" : "SAMPSON",
    "branch" : null,
    "contactInfo" : null,
    "guid" : null
  }, {
    "id" : null,
    "position" : null,
    "fullname" : "SAVINO",
    "branch" : null,
    "contactInfo" : null,
    "guid" : null
  }, {
    "id" : null,
    "position" : null,
    "fullname" : "SERRANO",
    "branch" : null,
    "contactInfo" : null,
    "guid" : null
  }, {
    "id" : null,
    "position" : null,
    "fullname" : "SMITH",
    "branch" : null,
    "contactInfo" : null,
    "guid" : null
  }, {
    "id" : null,
    "position" : null,
    "fullname" : "STAVISKY",
    "branch" : null,
    "contactInfo" : null,
    "guid" : null
  }, {
    "id" : null,
    "position" : null,
    "fullname" : "STEWART-COUSINS",
    "branch" : null,
    "contactInfo" : null,
    "guid" : null
  }, {
    "id" : null,
    "position" : null,
    "fullname" : "VALESKY",
    "branch" : null,
    "contactInfo" : null,
    "guid" : null
  } ],
  "pastCommittees" : null,
  "fulltext" : "\n                           S T A T E   O F   N E W   Y O R K\n       ________________________________________________________________________\n\n                                         1025\n\n                              2011-2012 Regular Sessions\n\n                                   I N  S E N A T E\n\n                                      (PREFILED)\n\n                                    January 5, 2011\n                                      ___________\n\n       Introduced  by  Sens.  KLEIN,  ADAMS,  ADDABBO,  BRESLIN,  DIAZ,  DILAN,\n         HASSELL-THOMPSON, HUNTLEY, MONTGOMERY, OPPENHEIMER,  PARKER,  PERKINS,\n         SAMPSON, SAVINO, SERRANO, SMITH, STAVISKY, STEWART-COUSINS, VALESKY --\n         read  twice  and  ordered printed, and when printed to be committed to\n         the Committee on Judiciary\n\n       AN ACT to amend the general obligations law, in relation to compensation\n         for injury caused by the illegal sale  of  alcoholic  beverages  to  a\n         person under the age of twenty-one years\n\n         THE  PEOPLE OF THE STATE OF NEW YORK, REPRESENTED IN SENATE AND ASSEM-\n       BLY, DO ENACT AS FOLLOWS:\n\n    1    Section 1. Subdivision 1 of section 11-100 of the general  obligations\n    2  law,  as  amended by chapter 274 of the laws of 1985, is amended to read\n    3  as follows:\n    4    1. Any person who shall be  injured  in  person,  property,  means  of\n    5  support  or  otherwise,  by  reason of the intoxication or impairment of\n    6  ability of any person under the age of twenty-one years, whether result-\n    7  ing in his OR HER death or not, shall have a right of action to  recover\n    8  actual damages against:\n    9    (A) any person who knowingly causes such intoxication or impairment of\n   10  ability by unlawfully furnishing to or unlawfully assisting in procuring\n   11  alcoholic  beverages  for such INTOXICATED OR IMPAIRED person with know-\n   12  ledge or reasonable cause to believe that such person was under the  age\n   13  of twenty-one years[.]; OR\n   14    (B)  ANY PERSON OR ENTITY THAT PRODUCES AND SELLS, DIRECTLY OR THROUGH\n   15  A THIRD PARTY, A FALSE IDENTIFICATION DOCUMENT, AS SUCH TERM IS  DEFINED\n   16  IN  SUBDIVISION  ONE  OF  SECTION ONE HUNDRED FORTY-THREE OF THE GENERAL\n   17  BUSINESS LAW, OR A FALSELY MADE, COMPLETED OR  ALTERED  WRITTEN  INSTRU-\n   18  MENT,  AS  SUCH TERMS ARE DEFINED IN SECTION 170.00 OF THE PENAL LAW, TO\n   19  ANOTHER PERSON UNDER THE AGE OF TWENTY-ONE YEARS  AND  THE  DOCUMENT  OR\n   20  INSTRUMENT  MISREPRESENTS  THE  AGE AND/OR IDENTITY OF SUCH OTHER PERSON\n\n        EXPLANATION--Matter in ITALICS (underscored) is new; matter in brackets\n                             [ ] is old law to be omitted.\n                                                                  LBD04411-01-1\n\n       S. 1025                             2\n\n    1  AND IS USED TO UNLAWFULLY PROCURE  ALCOHOLIC  BEVERAGES  THAT  CAUSE  OR\n    2  CONTRIBUTE TO SUCH OTHER PERSON'S INTOXICATION OR IMPAIRMENT OF ABILITY.\n    3  ACTUAL  KNOWLEDGE OF THE SPECIFIC PROCUREMENT OF THE ALCOHOLIC BEVERAGES\n    4  THAT  CAUSE OR CONTRIBUTE TO THE INTOXICATION OR IMPAIRMENT SHALL NOT BE\n    5  NECESSARY.\n    6    S 2. This act shall take effect immediately.\n",
  "memo" : null,
  "law" : null,
  "actClause" : "AN ACT to amend the general obligations law, in relation to compensation for injury caused by the illegal sale of alcoholic beverages to a person under the age of twenty-one years ",
  "sortIndex" : -1,
  "latestAmendment" : null,
  "sobiReferenceList" : [ "SOBI.D110104.T154014.TXT", "SOBI.D110106.T131218.TXT", "SOBI.D110104.T153013.TXT", "SOBI.D110104.T150512.TXT" ],
  "luceneActive" : true,
  "luceneModified" : 1294337538787
}