{
  "year" : 2011,
  "senateBillNo" : "S2148-2011",
  "billEvents" : [ {
    "eventDate" : 1295326800000,
    "eventText" : "REFERRED TO MENTAL HEALTH AND DEVELOPMENTAL DISABILITIES",
    "billEventId" : "S2148-2011-1295326800000-REFERRED+TO+MENTAL+HEALTH+AND+DEVELOPMENTAL+DISABILITIES",
    "sobiReferenceList" : [ ],
    "luceneActive" : true,
    "luceneModified" : 0
  } ],
  "votes" : null,
  "sponsor" : {
    "id" : null,
    "position" : null,
    "fullname" : "MCDONALD",
    "branch" : null,
    "contactInfo" : null,
    "guid" : null
  },
  "title" : "Defines a bill of rights for persons with autism or autism spectrum disorders",
  "summary" : "Defines a bill of rights for persons with autism or autism spectrum disorders. ",
  "currentCommittee" : "MENTAL HEALTH AND DEVELOPMENTAL DISABILITIES",
  "sameAs" : "A1708",
  "lawSection" : "Mental Hygiene Law",
  "previousVersions" : [ "S6732-2009" ],
  "coSponsors" : [ {
    "id" : null,
    "position" : null,
    "fullname" : "ADAMS",
    "branch" : null,
    "contactInfo" : null,
    "guid" : null
  }, {
    "id" : null,
    "position" : null,
    "fullname" : "ADDABBO",
    "branch" : null,
    "contactInfo" : null,
    "guid" : null
  }, {
    "id" : null,
    "position" : null,
    "fullname" : "BONACIC",
    "branch" : null,
    "contactInfo" : null,
    "guid" : null
  }, {
    "id" : null,
    "position" : null,
    "fullname" : "DEFRANCISCO",
    "branch" : null,
    "contactInfo" : null,
    "guid" : null
  }, {
    "id" : null,
    "position" : null,
    "fullname" : "GRIFFO",
    "branch" : null,
    "contactInfo" : null,
    "guid" : null
  }, {
    "id" : null,
    "position" : null,
    "fullname" : "HASSELL-THOMPSON",
    "branch" : null,
    "contactInfo" : null,
    "guid" : null
  }, {
    "id" : null,
    "position" : null,
    "fullname" : "LANZA",
    "branch" : null,
    "contactInfo" : null,
    "guid" : null
  }, {
    "id" : null,
    "position" : null,
    "fullname" : "LARKIN",
    "branch" : null,
    "contactInfo" : null,
    "guid" : null
  }, {
    "id" : null,
    "position" : null,
    "fullname" : "LAVALLE",
    "branch" : null,
    "contactInfo" : null,
    "guid" : null
  }, {
    "id" : null,
    "position" : null,
    "fullname" : "LITTLE",
    "branch" : null,
    "contactInfo" : null,
    "guid" : null
  }, {
    "id" : null,
    "position" : null,
    "fullname" : "MAZIARZ",
    "branch" : null,
    "contactInfo" : null,
    "guid" : null
  }, {
    "id" : null,
    "position" : null,
    "fullname" : "MONTGOMERY",
    "branch" : null,
    "contactInfo" : null,
    "guid" : null
  }, {
    "id" : null,
    "position" : null,
    "fullname" : "PARKER",
    "branch" : null,
    "contactInfo" : null,
    "guid" : null
  }, {
    "id" : null,
    "position" : null,
    "fullname" : "PERKINS",
    "branch" : null,
    "contactInfo" : null,
    "guid" : null
  }, {
    "id" : null,
    "position" : null,
    "fullname" : "SAVINO",
    "branch" : null,
    "contactInfo" : null,
    "guid" : null
  } ],
  "pastCommittees" : null,
  "fulltext" : "\n                           S T A T E   O F   N E W   Y O R K\n       ________________________________________________________________________\n\n                                         2148\n\n                              2011-2012 Regular Sessions\n\n                                   I N  S E N A T E\n\n                                   January 18, 2011\n                                      ___________\n\n       Introduced  by  Sens.  McDONALD,  ADAMS,  ADDABBO, BONACIC, DeFRANCISCO,\n         GRIFFO, HASSELL-THOMPSON, LANZA,  LARKIN,  LAVALLE,  LITTLE,  MAZIARZ,\n         MONTGOMERY, PARKER, PERKINS, SAVINO -- read twice and ordered printed,\n         and when printed to be committed to the Committee on Mental Health and\n         Developmental Disabilities\n\n       AN  ACT  to amend the mental hygiene law, in relation to defining a bill\n         of rights for persons with autism or autism spectrum disorders\n\n         THE PEOPLE OF THE STATE OF NEW YORK, REPRESENTED IN SENATE AND  ASSEM-\n       BLY, DO ENACT AS FOLLOWS:\n\n    1    Section  1.  The mental hygiene law is amended by adding a new section\n    2  16.39 to read as follows:\n    3  S 16.39 BILL OF RIGHTS FOR PERSONS WITH AUTISM OR AUTISM SPECTRUM DISOR-\n    4            DERS.\n    5    (A) BOTH EARLY INTERVENTION AND CONTINUING TREATMENT ARE  INTEGRAL  TO\n    6  THE  HEALTHCARE OF THOSE DIAGNOSED WITH AUTISM OR AUTISM SPECTRUM DISOR-\n    7  DERS.  INSURANCE COMPANIES SHALL NOT  DISCRIMINATE  AGAINST  INDIVIDUALS\n    8  WITH SUCH DIAGNOSES BY IMPOSING FINANCIAL BURDENS AND BARRIERS TO TREAT-\n    9  MENT SUCH AS DIFFERENTIAL DEDUCTIBLES, DISPARATE CO-PAYS, SPENDING CAPS,\n   10  AND  ARBITRARY  LIMITS ON ACCESS TO MEDICALLY NECESSARY INPATIENT AND/OR\n   11  OUTPATIENT SERVICES.\n   12    (B) ALL PERSONS WITH AUTISM OR AUTISM SPECTRUM  DISORDERS  SHALL  HAVE\n   13  THE FOLLOWING RIGHTS:\n   14    (1)  THE  RIGHT TO AN INCREASED INVESTMENT IN HIGH-QUALITY RESEARCH ON\n   15  THE ORIGIN, DIAGNOSIS AND TREATMENT OF AUTISM AND AUTISM SPECTRUM DISOR-\n   16  DERS;\n   17    (2) THE RIGHT TO ACCESS,  AND  HAVE  THEIR  PARENTS  AND/OR  GUARDIANS\n   18  ACCESS,  A COMPREHENSIVE CONTINUUM OF CARE BASED ON THE PATIENT'S NEEDS-\n   19  -INCLUDING A FULL RANGE OF PSYCHOSOCIAL, BEHAVIORAL, PHARMACOLOGICAL AND\n   20  EDUCATIONAL SERVICES--REGARDLESS OF THE COST;\n   21    (3) THE RIGHT TO RECEIVE TREATMENT WITHIN A COORDINATED SYSTEM OF CARE\n   22  WHERE ALL AGENCIES DELIVERING SERVICES (INCLUDING  BUT  NOT  LIMITED  TO\n\n        EXPLANATION--Matter in ITALICS (underscored) is new; matter in brackets\n                             [ ] is old law to be omitted.\n                                                                  LBD01575-01-1\n\n       S. 2148                             2\n\n    1  HEALTH,  MENTAL  HEALTH,  CHILD WELFARE, JUVENILE JUSTICE AND EDUCATION)\n    2  WORK TOGETHER TO OPTIMIZE TREATMENT OUTCOME;\n    3    (4)  THE RIGHT TO RECEIVE IN-HOME CARE, AS WELL AS TREATMENT IN COMMU-\n    4  NITY-BASED SETTINGS AS CLOSE TO HOME AS POSSIBLE;\n    5    (5) THE RIGHT TO RECEIVE CARE FROM HIGHLY QUALIFIED PROFESSIONALS  WHO\n    6  ACT IN THE BEST INTERESTS OF THE PATIENT AND FAMILY;\n    7    (6)  THE RIGHT TO TREATMENT THAT IS FAMILY-DRIVEN AND PATIENT-FOCUSED.\n    8  PARENTS AND/OR GUARDIANS (AND PATIENTS WHEN APPROPRIATE) MUST  HAVE  THE\n    9  PRIMARY DECISION-MAKING ROLE WITH REGARD TO TREATMENT;\n   10    (7)  THE  RIGHT  TO  RECEIVE,  AND HAVE THEIR PARENTS AND/OR GUARDIANS\n   11  RECEIVE, ALL INFORMATION REGARDING THE RISKS, BENEFITS  AND  ANTICIPATED\n   12  OUTCOMES OF ALL AVAILABLE TREATMENT OPTIONS THAT IS NECESSARY TO FACILI-\n   13  TATE EDUCATED DECISIONS AND INFORMED CONSENT;\n   14    (8)  THE  RIGHT  TO  ACCESS,  AND  HAVE THEIR PARENTS AND/OR GUARDIANS\n   15  ACCESS, MENTAL HEALTH PROFESSIONALS WITH APPROPRIATE TRAINING AND  EXPE-\n   16  RIENCE.    PRIMARY  CARE  PROFESSIONALS PROVIDING MENTAL HEALTH SERVICES\n   17  MUST HAVE ACCESS TO CONSULTATION AND REFERRAL RESOURCES  FROM  QUALIFIED\n   18  MENTAL HEALTH PROFESSIONALS; AND\n   19    (9)  THE  RIGHT  TO APPROPRIATE MONITORING OF PHARMACEUTICAL TREATMENT\n   20  FOR MENTAL DISORDERS, BOTH TO OPTIMIZE THE BENEFITS AND TO MINIMIZE  ANY\n   21  RISKS OR POTENTIAL SIDE-EFFECTS ASSOCIATED WITH SUCH TREATMENTS.\n   22    S 2. This act shall take effect immediately.\n",
  "memo" : null,
  "law" : null,
  "actClause" : "AN ACT to amend the mental hygiene law, in relation to defining a bill of rights for persons with autism or autism spectrum disorders ",
  "sortIndex" : -1,
  "latestAmendment" : null,
  "sobiReferenceList" : [ "SOBI.D110118.T114126.TXT", "SOBI.D110118.T110118.TXT", "SOBI.D110118.T121130.TXT", "SOBI.D110118.T154652.TXT" ],
  "luceneActive" : true,
  "luceneModified" : 1295383612511
}