{
  "year" : 2011,
  "senateBillNo" : "S584-2011",
  "billEvents" : [ {
    "eventDate" : 1294203600000,
    "eventText" : "REFERRED TO FINANCE",
    "billEventId" : "S584-2011-1294203600000-REFERRED+TO+FINANCE",
    "sobiReferenceList" : [ ],
    "luceneActive" : true,
    "luceneModified" : 0
  } ],
  "votes" : null,
  "sponsor" : {
    "id" : null,
    "position" : null,
    "fullname" : "KLEIN",
    "branch" : null,
    "contactInfo" : null,
    "guid" : null
  },
  "title" : "Relates to display of missing in attack on our nation flag commonly known as MIA-OON flag",
  "summary" : "Relates to display of Missing In Attack On Our Nation flag commonly known as MIA-OON flag. ",
  "currentCommittee" : "FINANCE",
  "sameAs" : null,
  "lawSection" : "Executive Law",
  "previousVersions" : [ "S3186-2009" ],
  "coSponsors" : [ {
    "id" : null,
    "position" : null,
    "fullname" : "ADAMS",
    "branch" : null,
    "contactInfo" : null,
    "guid" : null
  }, {
    "id" : null,
    "position" : null,
    "fullname" : "ADDABBO",
    "branch" : null,
    "contactInfo" : null,
    "guid" : null
  }, {
    "id" : null,
    "position" : null,
    "fullname" : "ALESI",
    "branch" : null,
    "contactInfo" : null,
    "guid" : null
  }, {
    "id" : null,
    "position" : null,
    "fullname" : "BRESLIN",
    "branch" : null,
    "contactInfo" : null,
    "guid" : null
  }, {
    "id" : null,
    "position" : null,
    "fullname" : "DILAN",
    "branch" : null,
    "contactInfo" : null,
    "guid" : null
  }, {
    "id" : null,
    "position" : null,
    "fullname" : "FLANAGAN",
    "branch" : null,
    "contactInfo" : null,
    "guid" : null
  }, {
    "id" : null,
    "position" : null,
    "fullname" : "GOLDEN",
    "branch" : null,
    "contactInfo" : null,
    "guid" : null
  }, {
    "id" : null,
    "position" : null,
    "fullname" : "HASSELL-THOMPSON",
    "branch" : null,
    "contactInfo" : null,
    "guid" : null
  }, {
    "id" : null,
    "position" : null,
    "fullname" : "JOHNSON",
    "branch" : null,
    "contactInfo" : null,
    "guid" : null
  }, {
    "id" : null,
    "position" : null,
    "fullname" : "KRUEGER",
    "branch" : null,
    "contactInfo" : null,
    "guid" : null
  }, {
    "id" : null,
    "position" : null,
    "fullname" : "LANZA",
    "branch" : null,
    "contactInfo" : null,
    "guid" : null
  }, {
    "id" : null,
    "position" : null,
    "fullname" : "LARKIN",
    "branch" : null,
    "contactInfo" : null,
    "guid" : null
  }, {
    "id" : null,
    "position" : null,
    "fullname" : "MAZIARZ",
    "branch" : null,
    "contactInfo" : null,
    "guid" : null
  }, {
    "id" : null,
    "position" : null,
    "fullname" : "OPPENHEIMER",
    "branch" : null,
    "contactInfo" : null,
    "guid" : null
  }, {
    "id" : null,
    "position" : null,
    "fullname" : "PERALTA",
    "branch" : null,
    "contactInfo" : null,
    "guid" : null
  }, {
    "id" : null,
    "position" : null,
    "fullname" : "PERKINS",
    "branch" : null,
    "contactInfo" : null,
    "guid" : null
  }, {
    "id" : null,
    "position" : null,
    "fullname" : "SALAND",
    "branch" : null,
    "contactInfo" : null,
    "guid" : null
  }, {
    "id" : null,
    "position" : null,
    "fullname" : "SAVINO",
    "branch" : null,
    "contactInfo" : null,
    "guid" : null
  } ],
  "pastCommittees" : null,
  "fulltext" : "\n                           S T A T E   O F   N E W   Y O R K\n       ________________________________________________________________________\n\n                                          584\n\n                              2011-2012 Regular Sessions\n\n                                   I N  S E N A T E\n\n                                      (PREFILED)\n\n                                    January 5, 2011\n                                      ___________\n\n       Introduced by Sens. KLEIN, ADAMS, ADDABBO, ALESI, BRESLIN, DILAN, FLANA-\n         GAN,   GOLDEN,  HASSELL-THOMPSON,  JOHNSON,  KRUEGER,  LANZA,  LARKIN,\n         MAZIARZ, OPPENHEIMER, PERALTA, PERKINS, SALAND, SAVINO --  read  twice\n         and ordered printed, and when printed to be committed to the Committee\n         on Finance\n\n       AN ACT to amend the executive law, in relation to display of the Missing\n         In Attack On Our Nation flag on public buildings\n\n         THE  PEOPLE OF THE STATE OF NEW YORK, REPRESENTED IN SENATE AND ASSEM-\n       BLY, DO ENACT AS FOLLOWS:\n\n    1    Section 1. The executive law is amended by adding a new section  403-c\n    2  to read as follows:\n    3    S 403-C. DISPLAY OF MISSING IN ATTACK ON OUR NATION FLAG TO BE COMMON-\n    4  LY KNOWN AS THE MIA-OON FLAG. 1. EVERY COUNTY, CITY, TOWN AND VILLAGE IS\n    5  ENCOURAGED TO DISPLAY THE MIA-OON FLAG AT THE BUILDING HOUSING ITS LOCAL\n    6  LEGISLATIVE  BODY  FOR  A PERIOD OF THIRTY DAYS OR SUCH LONGER PERIOD AS\n    7  THAT BODY DEEMS APPROPRIATE EVERY YEAR COMMENCING EACH  SEPTEMBER  ELEV-\n    8  ENTH.\n    9    2. EVERY STATE POLICE FACILITY, INCLUDING BUT NOT LIMITED TO THE HEAD-\n   10  QUARTERS, SUBSTATIONS AND TRAINING ACADEMY, IS ENCOURAGED TO DISPLAY THE\n   11  MIA-OON  FLAG  FOR  A PERIOD OF THIRTY DAYS OR SUCH LONGER PERIOD AS THE\n   12  SUPERINTENDENT OF THE STATE POLICE DEEMS APPROPRIATE EVERY YEAR COMMENC-\n   13  ING EACH SEPTEMBER ELEVENTH.\n   14    3. THE MIA-OON FLAG SHALL DISPLAY A BLACK SILHOUETTE OF A MOTHER HOLD-\n   15  ING HER CHILD'S HAND UPON A FIELD OF YELLOW. UNDERNEATH THE IMAGE  SHALL\n   16  BE  THE  PHRASE  \"YOU WILL ALWAYS BE REMEMBERED\" IN BLACK LETTERING. THE\n   17  IMAGE OF MOTHER AND CHILD SHALL SYMBOLIZE THE VULNERABILITY OF INNOCENTS\n   18  TO TERRORIST ATTACK, WHILE THE YELLOW SHALL SYMBOLIZE THAT  THOSE  TAKEN\n   19  BY TERRORIST ATTACKS WILL BE RETURNED TO THEIR LOVED ONES.\n   20    S 2. This act shall take effect immediately.\n\n        EXPLANATION--Matter in ITALICS (underscored) is new; matter in brackets\n                             [ ] is old law to be omitted.\n                                                                  LBD04771-01-1\n",
  "memo" : null,
  "law" : null,
  "actClause" : "AN ACT to amend the executive law, in relation to display of the Missing In Attack On Our Nation flag on public buildings ",
  "sortIndex" : -1,
  "latestAmendment" : null,
  "sobiReferenceList" : [ "SOBI.D101222.T145346.TXT", "SOBI.D101222.T141841.TXT", "SOBI.D101227.T140559.TXT", "SOBI.D101222.T144345.TXT" ],
  "luceneActive" : true,
  "luceneModified" : 1293476759160
}